{
  "$schema": "https://raw.githubusercontent.com/sinwanjs/sinwan-ui-registry/main/registry.schema.json",
  "name": "sinwan-ui",
  "homepage": "https://sinwanjs.com",
  "aliasRoots": {
    "components": "src/components",
    "ui": "src/components/ui",
    "lib": "src/lib",
    "hooks": "src/hooks"
  },
  "items": [
    {
      "name": "accordion",
      "type": "registry:ui",
      "title": "Accordion",
      "description": "Vertically stacked headings that expand and collapse their sections.",
      "files": [
        {
          "path": "src/components/ui/accordion.tsx",
          "type": "registry:ui"
        }
      ]
    },
    {
      "name": "alert",
      "type": "registry:ui",
      "title": "Alert",
      "description": "Callout for important messages, with title and description slots.",
      "files": [
        {
          "path": "src/components/ui/alert.tsx",
          "type": "registry:ui"
        }
      ]
    },
    {
      "name": "alert-dialog",
      "type": "registry:ui",
      "title": "Alert Dialog",
      "description": "Modal dialog that interrupts the user and expects a confirmation.",
      "files": [
        {
          "path": "src/components/ui/alert-dialog.tsx",
          "type": "registry:ui"
        }
      ]
    },
    {
      "name": "aspect-ratio",
      "type": "registry:ui",
      "title": "Aspect Ratio",
      "description": "Container that keeps its content at a fixed width-to-height ratio.",
      "files": [
        {
          "path": "src/components/ui/aspect-ratio.tsx",
          "type": "registry:ui"
        }
      ]
    },
    {
      "name": "attachment",
      "type": "registry:ui",
      "title": "Attachment",
      "description": "File attachment preview with name, size and actions.",
      "files": [
        {
          "path": "src/components/ui/attachment.tsx",
          "type": "registry:ui"
        }
      ]
    },
    {
      "name": "avatar",
      "type": "registry:ui",
      "title": "Avatar",
      "description": "User image with a fallback shown while loading or on error.",
      "files": [
        {
          "path": "src/components/ui/avatar/avatar.tsx",
          "type": "registry:ui"
        },
        {
          "path": "src/components/ui/avatar/index.ts",
          "type": "registry:ui"
        },
        {
          "path": "src/components/ui/avatar/useAvatar.ts",
          "type": "registry:ui"
        }
      ]
    },
    {
      "name": "badge",
      "type": "registry:ui",
      "title": "Badge",
      "description": "Small status or label pill with variants.",
      "files": [
        {
          "path": "src/components/ui/badge.tsx",
          "type": "registry:ui"
        }
      ]
    },
    {
      "name": "breadcrumb",
      "type": "registry:ui",
      "title": "Breadcrumb",
      "description": "Navigation trail showing the current page within a hierarchy.",
      "files": [
        {
          "path": "src/components/ui/breadcrumb.tsx",
          "type": "registry:ui"
        }
      ]
    },
    {
      "name": "bubble",
      "type": "registry:ui",
      "title": "Bubble",
      "description": "Chat bubble with content, grouping and reactions.",
      "files": [
        {
          "path": "src/components/ui/bubble.tsx",
          "type": "registry:ui"
        }
      ]
    },
    {
      "name": "button",
      "type": "registry:ui",
      "title": "Button",
      "description": "Button with variants, sizes and a loading state.",
      "files": [
        {
          "path": "src/components/ui/button.tsx",
          "type": "registry:ui"
        }
      ]
    },
    {
      "name": "button-group",
      "type": "registry:ui",
      "title": "Button Group",
      "description": "Groups related buttons into a single segmented control.",
      "files": [
        {
          "path": "src/components/ui/button-group.tsx",
          "type": "registry:ui"
        }
      ]
    },
    {
      "name": "calendar",
      "type": "registry:ui",
      "title": "Calendar",
      "description": "Date picker calendar with single, multiple and range selection.",
      "files": [
        {
          "path": "src/components/ui/calendar/calendar.tsx",
          "type": "registry:ui"
        },
        {
          "path": "src/components/ui/calendar/index.ts",
          "type": "registry:ui"
        },
        {
          "path": "src/components/ui/calendar/useCalendar.ts",
          "type": "registry:ui"
        }
      ]
    },
    {
      "name": "card",
      "type": "registry:ui",
      "title": "Card",
      "description": "Surface with header, content and footer sections.",
      "files": [
        {
          "path": "src/components/ui/card.tsx",
          "type": "registry:ui"
        }
      ]
    },
    {
      "name": "carousel",
      "type": "registry:ui",
      "title": "Carousel",
      "description": "Slide carousel with previous/next controls and swipe support.",
      "files": [
        {
          "path": "src/components/ui/carousel/carousel.tsx",
          "type": "registry:ui"
        },
        {
          "path": "src/components/ui/carousel/index.ts",
          "type": "registry:ui"
        },
        {
          "path": "src/components/ui/carousel/useCarousel.ts",
          "type": "registry:ui"
        }
      ]
    },
    {
      "name": "chart",
      "type": "registry:ui",
      "title": "Chart",
      "description": "ECharts wrapper with theming, toolbox and 3D (echarts-gl) support. Chart types, components and echarts-gl load on demand.",
      "files": [
        {
          "path": "src/components/ui/chart/chart.tsx",
          "type": "registry:ui"
        },
        {
          "path": "src/components/ui/chart/index.ts",
          "type": "registry:ui"
        },
        {
          "path": "src/components/ui/chart/modules.ts",
          "type": "registry:ui"
        },
        {
          "path": "src/components/ui/chart/useChart.ts",
          "type": "registry:ui"
        },
        {
          "path": "src/lib/echarts-modules.d.ts",
          "type": "registry:lib"
        }
      ]
    },
    {
      "name": "checkbox",
      "type": "registry:ui",
      "title": "Checkbox",
      "description": "Accessible checkbox with checked and indeterminate states.",
      "files": [
        {
          "path": "src/components/ui/checkbox.tsx",
          "type": "registry:ui"
        }
      ]
    },
    {
      "name": "collapsible",
      "type": "registry:ui",
      "title": "Collapsible",
      "description": "Panel that shows and hides its content with an animation.",
      "files": [
        {
          "path": "src/components/ui/collapsible.tsx",
          "type": "registry:ui"
        }
      ]
    },
    {
      "name": "combobox",
      "type": "registry:ui",
      "title": "Combobox",
      "description": "Searchable select with a filterable list of options.",
      "files": [
        {
          "path": "src/components/ui/combobox/combobox.tsx",
          "type": "registry:ui"
        },
        {
          "path": "src/components/ui/combobox/index.ts",
          "type": "registry:ui"
        },
        {
          "path": "src/components/ui/combobox/useCombobox.ts",
          "type": "registry:ui"
        }
      ]
    },
    {
      "name": "command",
      "type": "registry:ui",
      "title": "Command",
      "description": "Command palette with search, groups and keyboard navigation.",
      "files": [
        {
          "path": "src/components/ui/command/command.tsx",
          "type": "registry:ui"
        },
        {
          "path": "src/components/ui/command/index.ts",
          "type": "registry:ui"
        },
        {
          "path": "src/components/ui/command/useCommand.ts",
          "type": "registry:ui"
        }
      ]
    },
    {
      "name": "context-menu",
      "type": "registry:ui",
      "title": "Context Menu",
      "description": "Right-click menu with items, checkboxes, radios and submenus.",
      "files": [
        {
          "path": "src/components/ui/context-menu/context-menu.tsx",
          "type": "registry:ui"
        },
        {
          "path": "src/components/ui/context-menu/index.ts",
          "type": "registry:ui"
        },
        {
          "path": "src/components/ui/context-menu/useContextMenu.ts",
          "type": "registry:ui"
        }
      ]
    },
    {
      "name": "data-table",
      "type": "registry:ui",
      "title": "Data Table",
      "description": "TanStack Table powered data table with sorting, filtering and pagination.",
      "files": [
        {
          "path": "src/components/ui/data-table/data-table-column-header.tsx",
          "type": "registry:ui"
        },
        {
          "path": "src/components/ui/data-table/data-table-features.ts",
          "type": "registry:ui"
        },
        {
          "path": "src/components/ui/data-table/data-table-node.ts",
          "type": "registry:ui"
        },
        {
          "path": "src/components/ui/data-table/data-table-pagination.tsx",
          "type": "registry:ui"
        },
        {
          "path": "src/components/ui/data-table/data-table-select.tsx",
          "type": "registry:ui"
        },
        {
          "path": "src/components/ui/data-table/data-table-view-options.tsx",
          "type": "registry:ui"
        },
        {
          "path": "src/components/ui/data-table/data-table.tsx",
          "type": "registry:ui"
        },
        {
          "path": "src/components/ui/data-table/index.ts",
          "type": "registry:ui"
        },
        {
          "path": "src/components/ui/data-table/useDataTable.ts",
          "type": "registry:ui"
        }
      ]
    },
    {
      "name": "dialog",
      "type": "registry:ui",
      "title": "Dialog",
      "description": "Modal window rendered in a portal with focus management.",
      "files": [
        {
          "path": "src/components/ui/dialog.tsx",
          "type": "registry:ui"
        }
      ]